{
  "id": "american-belgian-malinois-rescue",
  "name": "American Belgian Malinois Rescue",
  "aka": [],
  "parent_org": null,
  "org_types": [],
  "animals": [],
  "needs": [],
  "boroughs": [],
  "citywide": false,
  "outside_nyc": false,
  "neighborhoods": null,
  "zips": [],
  "region_note": null,
  "phones": [],
  "emails": [],
  "website": "https://www.malinoisrescue.org",
  "intake_urls": [],
  "social": [],
  "address": null,
  "hours": null,
  "notes": "Found on ACC New Hope partners on 2026-09-17. Nothing about this entry has been checked yet — not the phone number, not the address, not whether they are still operating. Confirm before relying on it.",
  "type_raw": null,
  "confidence": "Low",
  "status": "active",
  "status_note": null,
  "source_urls": [
    "https://www.nycacc.org/new-hope-partners"
  ],
  "last_verified": null,
  "section": "Discovered — ACC New Hope partners",
  "source_files": [
    "discovery"
  ],
  "last_checked": null,
  "check_status": "new-unverified",
  "consecutive_failures": 0,
  "change_log": [
    {
      "date": "2026-09-17",
      "field": "record",
      "from": null,
      "to": "added",
      "evidence_url": "https://www.nycacc.org/new-hope-partners",
      "source": "monthly-discovery",
      "note": "Listed on ACC New Hope partners."
    }
  ],
  "privacy_hold": false
}
