{
  "id": "rescue-nyc",
  "name": "Rescue NYC",
  "aka": [],
  "parent_org": null,
  "org_types": [
    "rescue-foster"
  ],
  "animals": [
    "dog"
  ],
  "needs": [
    "adoption",
    "surrender",
    "foster",
    "advocacy"
  ],
  "boroughs": [
    "manhattan"
  ],
  "citywide": false,
  "outside_nyc": false,
  "neighborhoods": "NYC-based; pulls from NYC ACC + local shelters",
  "zips": [],
  "region_note": "MANHATTAN (Manhattan-based dog rescues)",
  "phones": [],
  "emails": [],
  "website": "https://www.rescuenyc.org",
  "intake_urls": [],
  "social": [
    {
      "platform": "instagram",
      "handle": "rescue.nyc",
      "url": "https://instagram.com/rescue.nyc"
    }
  ],
  "address": null,
  "hours": null,
  "notes": "501(c)(3) NYC foster-based rescue and ACC New Hope partner. Pulls at-risk animals from the NYC shelter system into foster homes for rehoming. Foster-based, no facility. Verify contact via site before relying (site occasionally lists redirect URLs on aggregators). Phone: (no public phone; contact via site) Email: (via site contact form) Intake: Adopt/foster via site",
  "type_raw": "Rescue+adoption (foster-based)",
  "confidence": "Low",
  "status": "active",
  "status_note": null,
  "source_urls": [
    "https://www.nycacc.org/programs/new-hope-partners/"
  ],
  "last_verified": "2026-08-27",
  "section": "MANHATTAN (Manhattan-based dog rescues)",
  "source_files": [
    "research/NYC_Dog_Rescue_Reference.xlsx"
  ],
  "last_checked": null,
  "check_status": "unchecked",
  "consecutive_failures": 0,
  "change_log": [],
  "privacy_hold": false
}
