{
  "id": "good-home-pet-adoptions",
  "name": "Good Home Pet Adoptions",
  "aka": [
    "Good Home Pet Adoptions (Crown Heights)"
  ],
  "parent_org": null,
  "org_types": [
    "rescue-foster",
    "tnr-group",
    "support-program"
  ],
  "animals": [
    "cat",
    "wildlife"
  ],
  "needs": [
    "wildlife-rehab",
    "adoption",
    "surrender",
    "tnr",
    "trap-bank"
  ],
  "boroughs": [
    "brooklyn"
  ],
  "citywide": false,
  "outside_nyc": false,
  "neighborhoods": "Central Brooklyn (Crown Heights / Franklin Ave); local TNR",
  "zips": [
    "11238"
  ],
  "region_note": "CENTRAL BROOKLYN (Flatbush / Bed-Stuy / Crown Heights / Prospect Hts)",
  "phones": [],
  "emails": [
    {
      "value": "info@goodhomepetadoptions.org"
    }
  ],
  "website": "https://goodhomepetadoptions.org",
  "intake_urls": [],
  "social": [
    {
      "platform": "instagram",
      "handle": "goodhomepetadoptions",
      "url": "https://instagram.com/goodhomepetadoptions"
    }
  ],
  "address": null,
  "hours": null,
  "notes": "Central Brooklyn 501(c)(3) since 2018 (EIN 82-5099392) focused on rehabilitating/rehoming former street cats. Runs a physical free-roaming Cat Lounge, local TNR projects and a community TRAP BANK. Email confirmed on own listings. Verified 2026-08-26. Intake: Adoption application on site Intake: TNR/trap-bank support via email Other channel: free-roaming Cat Lounge at 751 Franklin Ave 11238 (in Beastie Bestie Pet Provisions), Sat/Sun 12-5 + Wed/Thu 2-7, $6 entry\n\ncommunity TRAP BANK, info@goodhomepetadoptions.org.",
  "type_raw": "rescue+adoption / TNR / trap bank",
  "confidence": "High",
  "status": "active",
  "status_note": null,
  "source_urls": [
    "https://goodhomepetadoptions.org/visit/",
    "https://www.adoptapet.com/shelter/90005-good-home-pet-adoptions-brooklyn-new-york"
  ],
  "last_verified": "2026-08-26",
  "section": "CENTRAL BROOKLYN (Flatbush / Bed-Stuy / Crown Heights / Prospect Hts)",
  "source_files": [
    "research/NYC_Cat_Rescue_TNR_Reference.xlsx"
  ],
  "last_checked": "2026-09-21",
  "check_status": "ok",
  "consecutive_failures": 0,
  "change_log": [],
  "privacy_hold": false
}
