{
  "id": "800-kitties-rescue",
  "name": "800 Kitties Rescue",
  "aka": [],
  "parent_org": null,
  "org_types": [
    "rescue-foster",
    "solo-rescuer"
  ],
  "animals": [
    "cat"
  ],
  "needs": [
    "adoption",
    "referral"
  ],
  "boroughs": [
    "brooklyn"
  ],
  "citywide": false,
  "outside_nyc": false,
  "neighborhoods": "Central/East Brooklyn",
  "zips": [],
  "region_note": "EAST BROOKLYN (Ocean Hill / Brownsville / East New York)",
  "phones": [],
  "emails": [],
  "website": null,
  "intake_urls": [],
  "social": [
    {
      "platform": "instagram",
      "handle": "800kittiesrescue",
      "url": "https://instagram.com/800kittiesrescue"
    }
  ],
  "address": null,
  "hours": null,
  "notes": "Hyper-local rescue from North Brooklyn Cats' directory. Instagram-primary; confirm via IG. Intake: Via Instagram DM",
  "type_raw": "solo rescuer / rescue+adoption",
  "confidence": "Low",
  "status": "active",
  "status_note": null,
  "source_urls": [
    "https://northbrooklyncats.org/resources/"
  ],
  "last_verified": "2026-08-26",
  "section": "EAST BROOKLYN (Ocean Hill / Brownsville / East New York)",
  "source_files": [
    "research/NYC_Cat_Rescue_TNR_Reference.xlsx"
  ],
  "last_checked": null,
  "check_status": "unchecked",
  "consecutive_failures": 0,
  "change_log": [],
  "privacy_hold": false
}
