{
  "id": "redrover-relief-safe-escape",
  "name": "RedRover Relief Safe Escape",
  "aka": [],
  "parent_org": null,
  "org_types": [
    "support-program"
  ],
  "animals": [
    "cat"
  ],
  "needs": [
    "owner-support",
    "boarding"
  ],
  "boroughs": [],
  "citywide": false,
  "outside_nyc": false,
  "neighborhoods": null,
  "zips": [],
  "region_note": "DOMESTIC-VIOLENCE PET SAFE-KEEPING (free; stay-together or safe foster)",
  "phones": [],
  "emails": [],
  "website": "https://redrover.org/domestic",
  "intake_urls": [],
  "social": [],
  "address": null,
  "hours": null,
  "notes": "grants help cover pet boarding/care for survivors leaving abuse. redrover.org/domestic.",
  "type_raw": null,
  "confidence": "Medium",
  "status": "active",
  "status_note": null,
  "source_urls": [],
  "last_verified": null,
  "section": "Owner support & surrender prev. — DOMESTIC-VIOLENCE PET SAFE-KEEPING (free; stay-together or safe foster)",
  "source_files": [
    "research/NYC_Cat_Rescue_TNR_Reference.xlsx"
  ],
  "last_checked": null,
  "check_status": "unchecked",
  "consecutive_failures": 0,
  "change_log": [],
  "privacy_hold": false
}
